text,Is_Sarcastic
"Hey hey hey, motherfuckers!",
My guy? Are you saging?,
"Right, bad juju. Maybe you should make a move, dude?",
I think just fuck off thanks. How’s it going?,
"Of course I’m okay. Obviously I’m okay. Why do you ask? What here? Oh, man, I’m so over all this. I was a bad fit. I was never a corporate cock-suck anyway. Besides. I never got this high in the fucking building! They stuck me in LA with Old Father Time, we were the pool boys, right, Frank. Fucking banana cabana? So. What’s the bid?",
"What that’s ‘commercially sensitive’ – I’m still on the board, bro!",
One-twenty-five! Fuck!?,
"Hey, Global Tom! How you shaking? You still fucking shit up for us?",
Sis. The pols still boring the living shit out of you?,
Ha! Look at you.* Walking around like you’re an actual human person!,
Yeah you wish!,
"Happy birthday, Dad.",
O-kay! Now the fucking’s started!  you’re getting fucked!,
PPG are balls deep in him. Hustling up a rival bid.,
"You know, I think the only thing worse for us than buying that piece of shit would be trying and losing.",
Well that’s unnecessary!,
It’s a – goo? Is it goo?,
.,
He wants some sourdough tips!,
"Dude, he’s gonna love it. He can let it rise while he does his yoga?",
What’s the deal?,
he—,
Well excuse me if I don’t want him to (die)—,
"Read the small print, asshole!",
Oh fuck!!,
I’m not even laughing – what?,
"Hey! What the fuck? Off the cloth, moth! Private! We’re not fourteen, dude!",
"We all need advice, man—",
"Oh, dude, come on—",
"Suck-up. ‘Gee you’re so great, Double-Vote-Power Mom!’",
Oh sure. I’m sure.,
"So? Well, you know. I guess, I want to do anything for you. . But—",
"No. God no. It’s your firm, Dad. It’s not ‘what’s in it for me’. But you know, what  in it for me?",
"Sure. Sure. It was just tough last time.  tough, with Frank over me, in LA.",
"Oh sure. I understand. It’s just, at the studio I had ideas, I’m quite an innovative thinker, but I found a certain amount of resistance?",
"No, what? ? It’s not about one great idea. It was a culture. I think he was maybe threatened by my energy?",
"Oh, I don’t know. You know me, I think we should liquidate. Financialize. Who wants pipes and product. When you can float hot with pure cash?",
"But if not. I’d wanna run the show. But, till that opened up. Chief Operating Officer. But I guess, that’s Frank?",
"Uh-huh, it  depend.",
"Plus, do you want to tell Dad no?",
Can we think about it?,
If Kendall’s going we need one more to make it fair!  You wanna?,
"C’mon. You’re up. Relax. Can you hit a ball? Cos I’ll give you a million dollars if you hit a home run, kid. I don’t know why you’re smiling. Seriously. A million.",
"Grace, where’s my—",
Oh you don’t want him incentivized! One million dollars for a home run.,
What’s the Frank situation?,
Yeah? Fuck.,
Um? Shiv?,
Um? Con?,
It’s not sufficiently attractive. As a proposition.,
Dad? It’s just a first position?,
Dad!,
What?,
"She said, ‘You’re my favorite, don’t tell Shiv.’ What do you think? She asked what happened. So I told her.",
"Thanks, big man. Huge relief.",
"Excuse me, are we in the best part of the hospital? Sorry – but we need to—",
Well he’s not dying.,
He did.,
Should we call Mom?,
I don’t know. It was freaky.,
"Yep, one second Shiv was hardballing Dad, the next he mumbled something and – you know.",
Someone said brain hemorrhage? Right?,
"Umm, the first – the ambulance guy?",
According to this it sounds like a stroke. Could be an acute subdural hematoma.,
Is it nice?,
PJ says Aziz Khan at the Mayo Clinic is the best there is.,
"Uh-huh, interesting. You think this is a good time to get him to stop biting his nails?",
He’s fine. It’s a fucking power-nap. Medical siesta.,
It’s fine. He’ll never retire and he’ll never die.,
You know Connor’s invited Willa down?,
"I don’t know. He saw an empty bed and it made him horny? I have no idea. — But listen, so I was thinking – this must be tough on Marcia.",
"No, look I know the trust only comes into play if certain things happen—",
"But I was thinking, wouldn’t it be nice for Dad to wake up and for us all to have signed, like he wanted? A nice gesture?",
"So, for the record, you’re declining to sign the change of trust?",
Okay. It just seems a bit shitty. Under the circumstances … ?,
"Well, you did make her husband’s brain explode …",
"We’re here for you, Marcia.",
"Oh just rumors, ‘taken to the hospital’. Some of Twitter says he’s dead. A good deal of – of – rejoicing at our father’s potential demise. Can you screengrab these fuckers who are saying shit?",
Scan. And the news is out.,
"Well Frank was fired, so?",
They’re gonna give us the results?,
He’s not an ‘older patient’.,
"But physically, he’s basically still in his seventies. And he’s in great shape. Thirty years.",
So I asked Greg to bring the change of trust—,
"—and when he brings them, we should sign them.",
"I’m sorry but even if we were talking about it, which we’re not, it wouldn’t necessarily be you, bro.",
I don’t know. Anyone. It could be me.,
Dad just made me COO?,
"Well, I think he was.",
I don’t see it that way.,
Are you saying I’m a dipshit?,
"Fuck you! He’s alive, you’re not the fucking boss—",
‘Control the narrative’. You probably yell that when you cum.,
"Oh no, the law? We couldn’t possibly break the law.",
It has. I feel sorry for him.,
"Yeah, right, that’s the flow.",
That’s right.,
"No, he does not need that.",
"Well, I’m not looking for it but I guess I’m already COO so another small step and—?",
Because?,
I don’t know what that means?,
"It doesn’t matter who does it, it’s temporary, anyone will do.",
Prick. Eva?,
Basically dead.,
So who? Someone Dad trusts. Dad doesn’t trust anyone. Apart from Frank. And he fired Frank for shits and giggles. Gerri?,
I like the sound of that.,
"Dad fired you, man.",
"He said that to be nice. What he meant was: You’re not up to it, and it’s going to be someone else.",
"Well you do kind of need it, really?",
Bravo. It was an excellent impression.  CONNOR I just want to say – I’m not getting involved.,
"Greg, how are you doing?",
"Listen, you’re at the apartment, right?",
"I know you’re getting PJs and all that shit. Just, pick up a sweater maybe. Also. My dad’s, okay?",
"Doesn’t matter. Not something washed. Something he’s worn, maybe, if you find one.",
"Just smell it. Okay. Jesus. I just want something that smells of him, okay. I just want that. Is that enough for you?",
"So, Gerri. How you doing?",
Baird?,
Ohh. Does he – with the tortoise?,
"Yeah. Of course! How is he? Yeah, no I do, I remember. Anyhoo thanks, for captaining us through this shitstorm. You do a good job, Gerri. You are a real good job-doer, my friend. Look, I’m not great at the whole corporate flirt, I’d rather just lube up and fuck, you know?",
"Yeah – so, look, for me and Shiv the Kendall thing doesn’t work, so we’re thinking. General Counsel, you know where the bodies are buried, you probably buried them ‘ha-ha’, so, you’d have the family’s support to step in and take the reins. Okay?",
Right. Can I ask why?,
"Okay. But— Gerri, excuse me but I’ve always thought of you, and I mean this in the best possible way, as a stone-cold killer bitch?",
Tortoises and lube.,
I thought I was a fuckhead?,
You said I wasn’t serious.,
And Shiv?,
Okay – I’m not uninterested.,
Only thing … Gerri turned down the top job. Does that mean something?,
No.,
It was mooted.,
Actual COO.,
"I said, why not?",
"Sis, please. I’m trying to bring us together here. I’m mediating.",
"Dude, Karl’s not going to—",
"Hey, cuz, you got the papers?",
"Look forward to working with you, bro.",
"Night, Dad. See you soon.",
A seven.,
"Okay well, I trust Pax. Pax says you’re the best.",
"He’s a prick. But he knows the best places. He’s the only person I trust on food. So I thought, I should trust him on, like, the opposite of food.",
"Dude, no need for the speech, I’m down.",
Serious as cancer. Seriouser. Fucking— money cancer. I gotta check out. I’m rolling COO now.,
"Operating Officer. Waystar Royco. If it operates, I chief it. Five-thirty is perfect.",
"Sure. Cool. Because the other five-thirty I’ll be – being an agent of change and you know, sacking people.",
A six?,
Argh! I think you popped something.,
Fuuuuuuuuck! That was brutal.,
Of course I was in! I’m COO.,
"Relax, bro. New trainer. It’ll be okay.",
"Fine, dude, I was only trying to be nice, that was a fucking shit show and you handled it like a moron is the truth.",
Fuck you.,
I have a pitch?,
How is he?,
"Well that’s good, right?",
She thinks Marcia’s poisoning him.,
"What, not including me?",
"Sure. For like five minutes. He was – he was pretty – you know, it wasn’t really ‘him’, him. There were tubes.",
Should we take twenty?,
Hey. I’m going to stand. Back. New trainer.,
Yowch— .,
He’s like a thousand percent better though. He’s like a bull in rhino hide.,
This morning he put on a sock. So.,
"Internet. Fucking game-changer, baby.",
VR could be a lifeboat?,
Porn could be a lifeboat?,
"Yeah on that, ‘the new regime’? Forgive me for whoring in but shouldn’t I be in there as well?",
"And in that equation, I’m the mud?",
What happened?,
What did you say?,
You heard?,
With me it’s usually – ‘Who was that maniac who put a watermelon on his dick?’,
"Hey, it’s me too, man. Don’t leave me out.",
Can I suggest something?,
Can I suggest we all take our shirts off?,
You know I beat off in my office earlier?,
"You know, we can be a pair of little fucking worms wriggling around in here – do what the button-down fuckheads say. No offense, Gerri.",
"Seriously, man. They could write an algorithm to run this place. But that’s not the answer. Break shit up. Disrupt. Yeah?",
"Or. What about, next-wave shit. Prop-co op-co. Turn group finance into a profit centre?",
"Hey if you’re gonna shit on every idea, I got places I could be.",
Poor Tom. Boo-hoo.,
"Maybe we cut a title or two, from physical production. Newspaper- wise? Online only?",
"Yum yum, blood! See – shirt-off shit?",
I guess we should ask – or tell—,
"I mean we should at least , right?",
"I just thought we were doing our plan, man. Shirts-off shit?",
B-man!,
"From up here, all the fucking ants, you can almost imagine they’re people, right?",
"Well here’s the thing, Brex, I can’t run today because my back has been fucked since Monday.",
"I assume you’re insured? I mean, I’m doing big shit, big big shit every day and so like losing even a quarter of a percent of my operating capacity, that has million- dollar implications. And I’m thinking, maybe, test case, I throw three or four dozen white-shoe lawyers at you and see what it would be like to actually physically destroy someone?",
"Fuck you – look at you, are you okay? No. I’m just saying, you need to take this seriously?",
Fuck you!,
Fuck you.,
Uh-huh. Thank you.,
Gracey? I’m trying to clean my fucking teeth here?,
"It’s quite a haunting image, isn’t it? The eye almost seems to follow you around the room?",
"You know your future senator? Apparently, this is her husband’s asshole.",
"He posted it himself. With the words, ‘Check out my asshole.’ On a website called Filthy Rich. For married people who want to fuck around.",
Um – just us I believe right now. Leak to ATN. My pal thought I’d be intrigued.,
Umm feisty!,
"Way below my level, Shiv. But my guess is, why not, a little? It’s dirty, it’s weird. And it’s evidence of precisely the sort of disgusting liberal metro butt-love that makes our viewership angry enough to buy pharmaceuticals.",
"Oh it’s worse than that, Shiv, I’d say, it’s – it’s – malicious.",
"Uh-huh. Would you actually say, it’s like we’re ‘partisan surrogates subverting the democractic process which underpins our whole way of life’.",
"Back where, what? Back in the chair?",
‘Good’? You’d love it if his brain fell out the back of his head!,
"You’re scared in case he’s going to push you out and your plans for you – know, Uber for news, Facebook for cats? Fucking open-plan office you on a dance platform jerking off idea gloop into – ‘think boxes’—",
Got to go.,
Frank?,
"Well correction – it’s not a good morning from my POV because you’re here, and I hate you.",
What the fuck is going on?,
"The fucking, the – the Weasel Prevails. That would be a good name for your autobiography – if they did books by, jerks.",
You’re pathetic.,
"Sure, man. He didn’t apologize when he hit our au pair with a car.",
Okay. You need to tell Dad to back the fuck off.,
He’s rehired Frank to babysit me and I don’t need a babysitter! Especially one I don’t get to fuck.,
"Yeah. I mean, you’re CEO, can he even do that?",
"You need to tell him to butt out. We’re running the show. Go back to bed, eat some soup. Get better.",
And what do I do with Frank?,
Thank you. Thank you. That’s good to hear. Because it’s a big job.,
If you want I could help you – we could tag-team it on Dad’s speech – at the Sad Sack Wasp Trap?,
You’re doing a joke? Fine. Who you taking?,
Doesn’t want to.,
What? How does that look? CEO can’t get an ugly sister to go to the ball?,
"Oh yeah, I’d fuck that in a minute. Ask her.",
"What a pathetic beta-cuck. ‘Would it be “cool”? Cos I got something secret in my pants, would it be okay to show please, or is that a trigger-warning, baby?’",
This isn’t a false flag is it? Did you piss on your own floor?,
"Well first, let him know where to go peepee and poopoo.",
You’re kidding?,
"Just another Saturday night, baby.",
"Dad, I don’t want to shit-talk Kendall. ‘He’s not up to the job’— but I think I speak for everyone when I say it’s great to see you back.",
"But – one thing, and I don’t mind, it’s fine. But I wanted to say – Frank is what to me now?",
But why?,
How do you mean—?,
"Well, I’ll press Tom? What? I’ve been waiting for Tom to get his feet fully under the table — The guy is a bit of a flake is the truth. But leave it with me. When are you coming back in again?",
"Uh-huh, but what does that mean?",
"Hi, don’t mean to intrude? Hold on, buddy. Thanks?",
"Well thank you, Grace, you delightful speaking timepiece.",
"Dude, if you like her that much why don’t you ask for her fucking number?",
"You clearly want to, right? Do you want to give him your number?",
"Dude, ask for her fucking number?",
He’s retiring? He’s a lizard?,
Dude? This is our charity. How much a plate? You’ve got to get at least a blowjob. That’s the law.,
"Well it’s the ethical code. I hate to say this, but she has behaved rather unethically here.",
"No one watches TV, Dad.",
Yeah. But not really.,
"Do all the news? Well, Kim Jong Pop, because that’s not how things work in this country.",
What? Sure. Who doesn’t. More than you’d think. A billion?,
Fuck you.,
"Fuck you. You fucking, piece of shit.",
"No! What the fuck. I think I’ve made it pretty fucking clear I need a modicum of space once every twenty-four hours! Fucking come in, my heart rate’s dropping like a stone anyway!",
"What, Dad? Sure. He just kept pouring. It just went everywhere. It was like he didn’t even see?",
"Local TV, local news? Here’s a local news story for you: ‘Elderly Local Man Doesn’t Notice He’s Getting Butt-Fucked By Google’.",
"Did you hear the way he talked to me? That was the tone, whole time I was at the studio.",
Who knows how many people live in Indonesia? I mean who even cares? Fuck Indonesia. It sounds like a medical condition.,
"How many people live up your ass, Father Dickmas?",
You gonna do something.,
"You should. And the only way he’ll respect you is if you try to destroy him. Because in your position, that’s exactly what he would try to do.",
The Thursday box office is trickling in and it’s . How is that possible?,
"Happy Thanksgiving to my favorite stepmom. Remember. No tongues, Mom!",
It’s just depressing is all.,
Hey. What are you up to?,
Are you smoking weed?,
Do you want to?,
Watch the door.,
"Oh yeah. You think I smoke schwag? Yeah, you’re gonna be  high.",
Fuck!,
. Now they think it’s going to set a fucking record for Thanksgiving box office.,
Well that’s true I never liked her.,
‘She want to take all my lovely money!’,
"This is what you’re dealing with, Shiv. This is heartland right here.",
"With Connor? Oh, that’s his whore.",
Of course he knows. He pays her to suck his cock.,
"I actually introduced them at a party a few years ago. She wasn’t a call girl then. Well, you could call her. She just hadn’t figured out she could charge.",
Happy Thanksgiving. This is my cousin Greg. He’s very excited to meet you. Would you excuse me?,
Shame I wasn’t on a percentage?,
Because I introduced you. I’d be a rich man by now! Oh. That’s right. I am anyway.,
"What? I was ironicizing. I just think it’s better to be honest about this stuff, we’re all just raking the green, baby.",
"Oh, ‘family style’, what almost like we’re a family?",
Bullshit!,
"You smoked squirrel? Grace, didn’t you try that?",
"Oh, god, please no. Wait. Did someone pay you to say that?",
"Uh-huh, you see me stamp collecting? I guess I could show you my rusty sheriff’s badge? Shiv’s got a big collection of pictures of those.",
But apart from that have you had a nice time?,
What are you doing? Who put this on?,
Why are you laughing?,
Assholes.,
"What the fuck, Grace?",
Yeah? Is it. Is it? Really?,
"Well look. Fine. But I think we have irreconcilable differences, so. I think we need to have a talk.",
"What talk? The ‘I’m sorry – insert name here – it’s just not working. I hope we can always be blah, let’s keep in blah, I’ll never forget such and such …’ That talk.",
Fuck the turkey?,
I’m thankful I wasn’t born a Siamese twin.,
"What, you would? To be like fused to someone by the chest. Or to have two bodies and one head. C’mon. Gross.",
And so say all of us!,
"Well I’m thankful you told us about that, Dad?",
Let’s hold him down and cut out his tongue.,
"You’re ‘going steady’? What are you, nine?",
"I went to the market and bought a crack pipe … What? What? Okay, okay, I bought a gimp suit … Fine. I bought a potato, a new hat, a pony, a big fat hen and this. Come on, Dad, what’s it going to be? A hot dog. China. Immortality. Huh? The soul of the nation?",
Okay. Local TV and …,
"Dad gets to buy whatever he wants. So, come on, Pop – ‘and’—",
"Clock’s ticking. Time’s running out. Local TV, and what did I say?",
"Cheating! Come on, Dad!",
"—and I’m guessing, if I say, cortado with almond you’re going to look like I’m some kind of jerk, right, here in 1982 or wherever we are?",
"Oo! Lady Macbeth, getting her little fucking screwdriver in?",
"She’s a thousand years old. What has she got, something disgusting?",
"Alright, Captain fucking Prickle. Do you need to jerk off? Because I’m getting a lot of rage here.",
"Didn’t you go on a date with her daughter? You could rekindle the flame. Flash the wang, splooge us to victory?",
Except he hates you?,
"Oh c’mon, this is bullshit. We push, Lawrence is ours. Ewan could be ours. Ilona could be ours. Gerri can’t vote but she can talk for senior management. This is done, there’s being cautious and there’s being fucking time-wasters.",
"Okay. So I take Lawrence, you firm up the others?",
"I know the guy, I see him at every fucking fakers party and phoney soft opening I go to. We’re two peas in a metrosexual think-pod. Hey. Are we doing this? Are we running a fucking company together, or what? Just because I like a joke doesn’t mean I’m a fucking clown, and just cos you look like a fucking statue doesn’t mean you’re cool?",
Oh the delicacies? The little nuances I couldn’t possibly— Lawrence hates you.,
"Relax, old man. Relax. Tomorrow we storm the castle. Using your dome as a battering ram. I’m sorry, Wambsgans, but do you have a black eye?",
"Who, the guy who jammed his dick in your eye?",
"Oh, man, that’s our sister!",
"Yeah, and I’ve got to go eat some fucking – elk or something.",
Here’s to us!,
"Look at you fucking guys! If you ever have room for a threesome, let me know!",
"So look, Lawrence. I need to ask something. But – are we cool? Do we have a level? We can see each other?",
"And we’re disrupters, yeah?",
"Right? We don’t fear change. We eat change, yeah?",
"Cool, cool. So. Can I say something? What would you say if I told you there was going to be a vote of no confidence? Tomorrow. Kick out the old man, in with the new guard. Romey and the Homey.",
It’s me and Kendall. Romey and the Homey. We storm the castle. We’re the fucking French New Wave—,
"My vision? Is like all the kids, all the black ones and the brown ones and all the white ones they all, get together and do wind power. And fuck, or something.",
Look. You know what. I ended up in a bookshop the other day and I just started to laugh?,
"Yeah, I looked at all the books cramming up all the walls and I just thought, you know, about the olden days, all the fucking monasteries and the bibles and the sermons and the ‘did Jesus say this? Or mean that?’ and all the wars and what-have-you. All . No one gives a fuck.",
"Oh, people are gonna read, but the old world it’s gone. Papers gone. ‘News’ gone. Channels gone. Big man gone. ‘Tune in to ABS at nine o’clock to get told what to think.’ No. Over. It’s all about the morsels, man, feed me the fucking tasty morsels. Keep me interested. That’s where we’re headed. Tasty morsels from groovy hubs. We need to be in the hub club.",
"Look. I’m dumb but I’m smart, okay? I’m too dumb to fix our whole company. I’ve got no attention span. This is the most interesting thing that’s happened in my whole life and I’m thinking about six other things. But I’m fucking smart enough to see what needs changing. And I’m smart enough to spot the people who can help, . So, are you in?",
Fuck. He knows. Does he know?,
He knows. Don’t go. It’s going to be horrible. He’ll chop your dick off and stuff it in your mouth.,
Did he mention me?,
He’s in.,
"Yes, for real. Fuck you.",
"Hey, man, so how are we feeling?",
Fucking nice guy. Lovely guy. We good? We solid?,
"Kendall? Where are you? We’ve already started, man, we started. What are we doing?",
Uh-huh?,
"Kendall? Ken, you there?",
"I think it’s a tough one. It’s tough, but maybe—",
Against.,
"Are you okay, Dad?",
Hey!,
We don’t know it was piss.,
I thought you weren’t talking to me?,
Oh very much the fuck. Very much the fuck indeed. The big man’s breaking down and everyone’s invited!,
Everybody.,
I’ve got to go. See you in Cuckooville.,
I need to talk to Kendall.,
He’s not available? What’s he doing? Playing with his fucking Legos? He’s nothing but available.,
"Well I know he is, so – c’mon, okay?",
Will you take a message?,
"Okay, the entertainment’s arrived! Wow, this is like the first stage of an orgy. Like kind of exciting but also super-awkward.",
"Hey, Tom.",
So where’s the actual head-doctor guy?,
I just hope he can cure your serious case of being a bitch.,
Fuck you.,
It’s ironic. Cos if anyone needs therapy it’s him.,
My guy’s surprised I made it through at all.,
I’m surprisingly well adjusted. You’re the looney tune. You’re just the best at hiding it.,
"Yeah, so, I think I’m going to reveal to him you sexually abused me.",
Yeah. You just would not stop.,
You’re the one who tried to fuck me.,
No. But – competitive advantage. Could come in handy some day!,
Me too!,
This is barely comprehensible.,
"Hi Alon, just FYI. I play it dumb but my SAT scores were off the chart. For context.",
"Oh okay. Well I guess that’s me told … ooh I feel so exposed. Please don’t brain-fuck me, Daddy.",
"You’re the expert, man.",
It is nice.,
I hear it. I hear it.,
He’s got a lot of power everywhere.,
I don’t mind.,
I don’t think you are?,
I don’t know.,
I mean he might not have meant to but – no.,
What are you doing?,
You can’t go! Can she?,
Really dive deep. Don’t be scared of what you’re going to find down there!,
Jump jump jump! You pussy!,
"The guy, his teeth— It’s bad, I dunno, maybe, someone—",
He just dived. He hit the bottom—,
"Well the teeth are in the head, Connor, they’re kind of a central feature.",
I didn’t think he’d jump head-first. Hey Karolina.,
"Jesus fucking Christ, man.",
"Yeah, you’re okay, buddy. Fuck!",
"We look good, Dad. We should talk.",
"Right, sure. And you actually want me to do that? Or is this just words we’re spewing for the camera?",
What? Where are you?,
What??,
Are you high?,
"Ken, will you send me a pin, just so I know you’re okay?",
"Just send me a fucking pin, okay? Do it now, are you doing it? I’m coming to get you, bro.",
I’m going to get Kendall. He’s … here. And – he’s not – great?,
"Hey, man? Man?",
"I’ve come to rescue you, man. Wow. Hi. I like what you’ve done with the wolves.",
"Come on, man, let’s get you out of here.",
Is that crank?,
"That will make you crash like fucking – Mohamed Atta, into – Princess Di.",
"Come on, let’s go.",
It was all bullshit. He didn’t even do it.,
