text,Is_Sarcastic
"GoJo full bore. Our library, our firepower and relationships for content. Good shit, not fucking, all gay moms and wheelchair kids, popular shit. And on the occasion you need to send up a smoke signal from Geneva it can all go through me. Cos we get each other.",
Oh boy is it ever!,
Yeah well a lot of that is upstream of our software and the login is—?,
"Look, I can’t piss near other men due to we don’t know what reason, but please – go ahead. Look. GoJo is your baby and we don’t want to interfere with what you do. You’re the genius. So, bearing that in mind, would you consider meeting with my dad?",
And you’d be interested in selling to us?,
Monday?,
And if I shake your hand now will I be able to tell my dad I basically just bought GoJo for him?,
Alright! Are we amazing? I think I might be the best businessman in America.,
"Um, so I dropped my phone in the urinal – oops! – would you retrieve and rice it for me? Thanks. Can you do us a bottle train, we’re celebrating?",
"A ‘bottle train’ with the – the sparklers and the fireworks and the hot girls and the whole – ‘yay I won, capitalism!’",
"Okay, here she is! Are you okay?",
Onlookers reported you having some kind of breakdown? People were anxious in case you swallowed your tongue?,
I heard it looked like a cry for help. ‘The Dance of the Sugar Plum Failure’.,
Yup.,
"Um, do you mind if I don’t say?",
"Don’t worry about it, Shivvy. Go cut a rug, I’ll handle the business.",
"I am being serious. I’ll talk to Dad, see if he wants to loop you in? He often does like to loop you in.",
Oh you’d finesse? Thank you! But how can you finesse something that’s already done? By ruining it maybe?,
Thing is Lukas and I have a connection and I don’t actually see how you fit into this?,
"Look, I know it’s been a bad day for you, what with hearing you’ve got to carry on sharing your apartment with the old meat wardrobe but try to keep your wig on, yeah?",
"Right. I saw you, sipping Dad’s champagne. You looked like you were sucking a lemon.",
Uh-huh. Were you thinking about all the dick you were going to ride while he was inside?,
"Did you think Tommy was going to jail? And Daddy was going to jail and I was going to jail and Kendall’s looney tunes? Did you think it was ladies’ night and they were playing your song? Because you were wrong. All the men have got together in man club and decided , so just .",
"Look I know it’s difficult for you. You don’t want to have to do the dance for Daddy, cos you are not a good dancer.",
Turns out he loves it when I do the daddy dance. But I guess that’s just because he loves me. He loves fucking me and he won’t fuck you.,
"Daddy doesn’t love his carrot-top anymore, even when she does her little daddy dance. — Happy birthday, motherfucker!",
—,
Oh no? Call the cops! Intruders have breached the masturbatorium!,
‘Sorry’!!,
"Oh dude, it’s too late, I already spoke to Matsson, who hates you by the way, and laughs at you constantly.",
Oh what ‘go gentle on birthday boy’?,
"What are you, fucking six? You lost. No need to be a baby about it.",
"It’s a fucking party game! He’s in Dad’s shit, we’re in his grill, everyone’s in the shit so don’t act clean.",
Oh you’re siding with traitor now?,
"Oh there’s a line now? No line for him, no line for you. But there’s a line for me? You’re a pair of stuck-up cunts who can’t fucking bear to see me win. —",
"Come on, Shitty Jesus, hit me! Punch me, Jesus! C’mon. You know you want to. Fucking prick. Happy fucking birthday, man!",
Just a little pre-meet!,
"Uh, yeah, yeah, so. We’re in discussions to acquire GoJo. —",
Um … not that advanced. Just getting to outline terms.,
"Yeah, except we’re not bopping you over the head, are we? We’re handing you a massively value-enhancing business- transformative acquisition. So, relax and think about the fucking honey, ah?",
"Well? We’re doing the dance, we’re nearly there on headline terms, and we’ll obviously value your input.",
"Uh-huh. Position A is he’s the bomb. Position B is ‘Oooh, twiddle my hispter’s tash maybe he’s  the bomb??’ But  he’s the fucking bomb. Their tech stack is sharp fucking cheddar. Their AI is terrifying. It’ll take a look at your lunch and give you six perfect suggestions for what to watch tonight with the wife the app is gonna match you with next fucking week.",
Uh-huh. I think that all worked.,
I can do it.,
No little jokes. I can do it.,
"Uh-huh. Thanks, Dad. And so you want me to send your apologies to Mom?",
Oh? Right. Yeah? I thought Peter could suck your – and she could eat your – whatever?,
Hey. I know you. Didn’t you used to be Shiv Roy?,
"Yeah at least I showed up, what were you doing? Brunching with some other sock-puppet girlboss presidents?",
"So, listen. Just to say, I’ve had Peter Onions rat-fucked.",
"The guy’s a tweedy little slime-badger. Three bankruptcies, two marriages, four kids, five shell companies. Big investor in shitty care homes. Tipping apple sauce down their gullets and telling them they had a four-course dinner.",
"So I’ve asked Mum if we can talk to her, and I think we should do it together.",
"Well, ask if she should be doing this? It’s like five months since ‘Rory’ was going to move in?",
"At least check she has a prenup. You know, she’s got all the stuff from the divorce in there, the holding company and everything and this guy is clearly on the make. So, yeah?",
‘Fuck it’?,
"Fine. Let him kill her for her emeralds and screw us out of the firm, see if I care.",
"Yeah well, you’re not really a part of that, either of you.",
"I mean I can’t quite fire you yet, Shiv, because I’m still a little scared of you. But what I’m thinking is, when I take over maybe I put you in the office next to mine and make you my sexy secretary? Sorry, Tom.",
Or I might make you my boss. And then whenever you tell me what to do I’ll tell you to fuck off.,
"Hey, you going to the welcome drinks because I’m going to hit it then I’m on with the banks, are you joining?",
Laurie Laurie Laurie. Will you  going on about him? You’re obsessed with him and it’s frankly disgusting.,
Sure. I’ll give the Swede a rub. Defrost the fucking meatball.,
"Laurie! What you got there, buddy?",
"Oh fuck yeah, tell me about it.",
"He seems great. Does he paint with a brush or his dick? Oh sorry, they’re watercolors, he doesn’t have a dick, right?",
Which? The dick pics. You don’t want pictures of my dick?,
Oh. I’m offended. Are you sure?,
Hm. Well I’m not sure. I think you do like them but you’re being kind of typically minxy.,
"Hey, Mom.",
Hey how you doing?,
Sure. Of course. And how’s business? I hear you’re big into the old silvery gulags?,
"Nah just your type. Another in the line of post-Dad posh, English phonies.",
"Easy, that’s my stepfather you’re talking about there!",
"Look, Mom, I’m not a big one for – you know, ‘saying things’ – But I’m just going to say: Are you sure about this? You know he has – like four kids?",
But do you have a prenup?,
"I’m just – a little concerned, Mom, are you rushing this?",
She ‘doesn’t want to live off macaroni and memorial services’?,
And apparently we’re meant to hate Peter because he was smart enough to get a scholarship and he bought his own furniture?,
Oh now you’re interested? She’s playing dumb. But she needs one. He’s a fucking – cad. He may be the world’s last remaining ‘bounder’.,
What do you think? Is he fucking—?,
Could be nothing. Could be just— I think it’s just fucking social media fireworks.,
"Hey, Lukas, call me. Are you high? Put the fucking venti ayahuasca Big Gulp down and call me, we need to be inside- track on this tweet, okay? I dunno. It’s his thing. He’s a trickster.",
"All under control, bro. Where you going, Naples to score junk?",
"Ooh my god, a gummy lovebite from those fucking toddlers. I think he likes us. I think he does, I feel that in my gut.",
Esports?,
Which is gravy. It’s good. This is fireworks gravy.,
"Fucking – Professor Murder She Wrote, here.",
I think we’re good.,
Okay. Here they come.,
He just does not give a single solitary fuck.,
"Shiv, don’t be silly, you have fun with Mom! I can manage, you’re not even that involved!",
Hey – what did he want?,
"I’ve tried but, no.",
I think – just bored. I mean does it change anything?,
You want me to call again? Hey. You okay?,
"Ken, he doesn’t want to see you. He doesn’t want to talk to you.",
He’s busy.,
No worries. Fun for all the family.,
Maybe? I think the boy one’s coming for you. That’s traditional.,
"Sure. No. Or, I dunno. Maybe wear a stab vest? I mean, it’d be okay. Maybe you should go? Get him out of the firm? You want me to come?",
Okay what is it?,
"Well he hates the phone, that doesn’t mean anything. I told Dad he hates the phone. He left me a voice memo. The tweets were fucking around. His lawyers have given him the Reg FD scares. He’s flying back to his Swiss place. There’s clarification coming.",
"Well he’s not. He just needs to ride it out. We don’t want to panic, Gerri, okay?",
"Well you are because you’re interrupting a great night, I’m getting very pally with Laurie. I might try to fuck him, see how that fits into our whole disgusting mess.",
Well sure. Does Dad want me to?,
"Hey dipshit. Hands off. Just off to save the world. Should be back for dinner. Greg, make sure the Contessa is kept occupied. But don’t look at her, everyone can see what you’re thinking and it’s disgusting.",
Fuck you.,
Amazing place.,
No?,
"Well don’t start telling me real shit, man, because I’m giving you nothing!",
Me? Worst?,
"Well I’m definitely not telling you a single one of my weaknesses, ever.",
"Right. Know that one. So listen, the tweet? Seriously, what was that?",
"But like, what you got cooking? Anything big coming out for you?",
"I mean were you trying to give your share price a pop by tweeting unverifiable information outside normal disclosure channels? But look, what I need to know is do you want this deal? Are you into the deal?",
"Okay. Because, I’m going to Milan to lock things down with Dad and the bankers – and the tweeting didn’t feel great, if you’re trying to blow this up, you can tell me. Yeah?",
I think it’s over.,
"Yeah, I’m not sure he is interested in getting acquired. I think he’s angling for a merger of equals.",
So it’s dead. Right?,
"Well thanks, Ger. I’m already so fucking stressed I’m jerking dust. Shall we tell him together?",
"Well, he’s a serious person.",
"Yes, Shiv, he’s serious. But. Dad, he thinks there’s value that isn’t priced in yet. Matsson’s gunning for a for a – merger of equals. So. I guess. You know? That probably—",
"He’s got twelve of the prime Asian sports leagues signed up for GoJo. He’s gonna fold it all in to the platform: live sports, games and betting. It’s a growth bomb.",
"Yes, Siobhan.",
No. The tweeting was a move.,
No. He’s on the snake. I know people. I’m a people-sniffer.,
He’s not a clown. He’s a motherfucker. It’s what you would have done. Right? He’s maximized leverage.,
Sure and I mean he wants the label but I think we could still be the puppy-fuckers here?,
"I think he’d let us craft it so we keep the balance of the board. I think he wants the freedom and he wants the status. GoJo Royco. Who gives a fuck? Give him the logo, we take the wheel.",
"But I’m sure you can trust Dad, guys?",
"‘Merger’ is really a state of mind, right? Dad, Gerri, you stay with your hands on the tiller. Their price rise is real. Proper fucking streamer. The future is movies, TV, music, games, sports, esports, AR, VR, betting – everything, to everyone. Matsson knows how to get there.",
Okay!,
"No, Dad, it’s just like – ‘Here’s my dick.’",
People just send each other pics of their dicks?,
Have you heard of dick pics?,
"I dunno. It’s like, ‘here’s my dick,’ I guess.",
Tabitha? She’s amazing. But we’re having some issues. And I hope this isn’t going to effect how we structure the negotiations going forward because I am inside this with Matsson and—,
I’m just screwing around!,
What happens now?,
"Yeah, Ger, you jump on the grenade. Thanks, pal.",
Why do you love trying to hurt me do you think?,
"I do know what you tried to do, you know, with Dad?",
Yeah once I explained it was just a fun tactic to undermine a female colleague he was actually really into it. He wants me to teach him.,
"Dad’s whole career is kind of one big dick pic sent to Western civilization, so?",
Oooh. Waitress service. Can I get a Cuba Libre and a club sandwich?,
"Go on, Willa, marry him! He’ll probably only last like ten years then it’s all gravy.",
"Greg, please concentrate. Your smile makes you look like a simpleton. Who’s that from?",
"Do not try to compete with me, Greg, I will destroy you. I will strip you down and sell you to an ostrich farm.",
Absolutely not. You have to auction. Where you going? Off to munch the farmer’s turnips with the rest of the herd?,
"Jesus. Look at her. Do you think good people cheat at , Shiv?",
"‘Ooooh I’m Shiv, I’m having a nervie B – I can’t get out of bed, bring more jello, Poppa’s gonna merge and leave me out in the cold.’",
Kurt Cobain of the fucking floaties.,
"Sure. But listen, if you find him in the pool again, there’s a C- note in it if you let him sink.",
Hey.,
"Oh, come on.",
Well. Okay. See you at the royal wedding.,
new lawyers?,
Mmm. Good instinct.,
"Oh, man.",
"Hey, Dad, all good?",
Should I jump on this or—?,
"Okay well, sure. It was heading that way.",
"Hey, don’t get sweaty, Betty. I’ll figure it all out and drop you an email.",
"You want me to come, Dad?",
"Okay, Dad?",
Oh sure. Yeah. Yup. —,
"No, Dad. Jesus. Do we have to—? The thing – I was just being horrible. It’s all good.",
"Hey, Dad—?",
"And I told Dad gaming, the cloud gaming?",
Yeah we don’t love Mark.,
We hear you have problems with binge and burn. We’ve got the good stuff.,
He’s in great shape. You know who he’s fucking?,
"Hey, Dad—?",
So – how was the ? Did you get to pay some income tax for the novelty value?,
Do you mind? I’m just all churned up about my big bro and I can’t think about that shit?,
"Sure. No, I don’t want you to die— Yeah. So.",
"Dude, you kind of tried to kill yourself and that’s not cool.",
Oh sure.,
"Well that may well be true, but you’re top of the pile right now, we’ll do mine tomorrow.",
"Hey, Con?",
But we’re not saying anything.,
It’s okay.,
What’s that?,
He’s him.,
All will be revealed. All will be revealed.,
"And do you not think, maybe one last check with Mom?",
Right. I just don’t know if he – you know? (Loves Mom.),
I am worried about the prenup.,
"But what if he poisons her, what if he pushes her down the stairs to get this flat he so loves?",
"Yeah, fuck off.",
Yeah yeah.,
Relax. It’s – cool beans.,
"Hey congrats, man. Finally ground her down.",
Is it the dried penis of one of the great men of history? Genghis Khan? Bing Crosby?,
Excuse me?,
Dad is—? Dad’s working on his jissom? Are you fucking kidding me?,
Are you serious? Dad’s scrambling the fighters?,
Okay well we need a plan to kill this baby.,
"What, in the spawn chamber, issuing his hellseed? Sure.",
"You two? Tom, you know her ovaries are covered in teeth, right? Her womb isn’t a womb, it’s a spiritual vacuum. She has canines where the eggs should be.",
"No, I think if Shiv could have kids it would have happened by now. Because she’s had a lot of sex with a lot of men.",
"You’re freezing? You know what she’s waiting for, don’t you, Tom? She’s gonna make you carry it.",
Seriously you’re gonna have to shit your own baby. Then squeeze your Tommy tits for man-milk. —,
Could be a number of things.,
"This is fine, this is good. But look. I’ll hit Kerry – will you take Marcia? Find out who’s up with Dad?",
Feel free to cut him dead by the way.,
"Sure, I don’t want to be rude but he’s what we call in our land ‘an irrelevant pauper’. You don’t need to listen to the pauper. It’s not for your royal ears.",
"Yeah so listen, kidding aside, I hear you might have been getting some tremors on the assistant loop?",
"Uh-huh? And when the company merges would you like to be inside or would you maybe like to be back at the turkey farm, taking the blind ones out to shit?",
"Thank you. I’m going to have vaginal sex in the missionary position with her, like a total fucking normo so leave well alone.",
Hey so excuse me but what did you say to Gerri just there?,
Uh-huh? And why are you lying? Did he tell you to lie?,
"Are you trying to have my dad’s baby? Because that’s an incredibly bad idea. It would be born old, attached to a walker. So – I think Karl and Frank are in Europe. There’s a bunch of new M&A advisors in Chianciano.",
"Euro ring. Hey Karlo! How you doing? Where are you, man? At – the office yeah? In your office? Great, well I’ll leave you to get on with your office job. Motherfucker. Marcia?",
"Look, um – so I should probably say, in terms of the meeting—? Matsson did kind of float, as an idea – maybe they buy us?",
"No I mean, yeah. He was like ‘no way, fuck you’.",
"Can we not make it a thing right away? We don’t know. Matsson pitched Dad the idea of them eating us, but I think he was flying a kite and Dad kind of shut it down.",
"I can’t remember the exact number of expletives, Siobhan. I’m not a fuckometer. —",
"Ken, what you think, he would never sell, would he?",
Ken?,
Is he shitting?,
"It’s okay, Ken.",
"I know, man. I know. You fucked it.",
"It’s just business. We’re all fucked, it’s okay. We’re all fucked. It all just got mixed up.",
Uh-huh.,
"Well, whatever, you’re – fine.",
"Oh come on, we’re kids. You’re not—",
Bullshit. C’mon. Bullshit.,
"I mean, if it pleases the court, you didn’t kill him, I mean sounds like he – killed him?",
I mean the road killed him? The road and the water killed him?,
"I mean so you, crashed, and you— What, then you, ran?",
"Well, see?",
"You dived? Like twice? I mean, that is actually kind of the story of a hero? I woulda been straight out of there? I woulda been out of that water like a fucking tabby cat out the bath, bro!",
"Bullshit. Nah, sounds like you’re at worst you’re an – irresponsibler. At very worst. You’re being very self-dramatizing with the murderer talk, actually. You’re bigging yourself up. At worst you’re a manslaughter-er.",
"Let’s get him back into the chapel, stuff him in a confessional and fix this. Who are you calling?",
"Oh great. Leave me with all the feeling. Thanks. What? I mean who hasn’t clipped the odd kid with a Porsche? It’s a rite of passage. I’ve killed a kid. Have you killed a kid, Shiv?",
"See, one waiter down. That’s why it took so long to get a fucking drink at her wedding.",
"No sure. I get it. I’m just saying, I’m the real victim here, I waited three-quarters of an hour for a gin and tonic.",
Can we trust that?,
"Nothing. I just don’t see a sale because, how would Dad be in charge?",
Okay so how does that work? How would he stay in charge?,
I just don’t see it.,
No way he fucks us.,
"Because. I think, I think he kind of does love us?",
"This is rumors. I will need to talk to him direct, just me.",
I am just saying as a matter of fact Dad and I have been working closely lately. I don’t wanna go in too aggressive.,
I’m not busting in there crying with Team Shiv. Okay? We have no idea how this will play out.,
I just don’t think we go in aggressive. I mean can we even actually stop him?,
I’m not sure I want to pull out something like that. Maybe I stick with what I have?,
I think with Dad pulling strings—,
"You see I want to disagree. But I’m scared, if I do, he’ll just off me. Drive us all into the sea.",
"What, too soon?",
And the holding-company move. That’s real?,
"But really equal? You two cunts don’t fucking big brother me out of my fucking piece here, okay?",
And the old guard?,
"And I have like four pieces of rat-fuck that kill Karl. I do think. That – although this literally makes me want to puke and I will want to kill you both every day and it all will end horribly – nevertheless, I do think we could, puke, make a, quote, pretty good team.",
"Well, Con, this  me layering you in. I can’t explain everything because it’s complicated and there’s no time and you’re a little slow – I’m kidding! But we wanted to tell you because you’re big brother and all. Well I understand …",
You can handle this?,
"Me? No, as long as you bitches don’t go waterpistols in Bali?",
"We were all gonna go in and squirt? Dad, under his canopy? I went and you fucks left me for dead?",
Convenient.,
"Hey, you, lawyery man, what’s that? Where’s Logan Roy?",
"Um, hey. Hey, all? Just feeling a bit out of the loop, Dad?",
"Yeah, um, we might have this wrong but we heard rumors about GoJo?",
It might be better – to – just so we all hear. —,
"I know what he said, Dad, but, really? Once Matsson’s calling the shots, we’re strung up in the town square.",
"Dad, we are here to say, the three of us to ask, and to say: Please do not do this.",
You need our vote for a change of control.,
Dad—?,
"Oh fuck, Mom – he got to you? —",
"Dad, please?",
"Dad, please. I dunno. Love?",
"Dad, why?",
"Con? Was it Con? Help us, Gerri. He’s not well. Help us stop him.",
Why? Because you’re Shiv’s fucking godmother.,
"Why, because I trust you. I fucking like you.",
"Frank? Fine, fuck you. You bitter, fucking shoe.",
I know you think I’m dumb. But you can’t see what I’ve got—,
Fuck you.,
"Um, no. Next. Right, fuckchops?",0
Exciting.,1
Hard no.,0
But go on. I do like them. We do. It’s just they’re kind of shitty.,1
I mean we can be honest here?,0
No. I feel like we said ‘iconic’ but you’re leaning ironic. What?,1
"Well don’t patronize me, bitch.",0
Whereas you can only get hard looking in the mirror. It’s true. I hear he got holes drilled in his full-length mirror and his butler stuffs it with kiwis so he can fuck himself awake.,0
Cool. You look tired and your face is giving me a headache.,1
"So, where have you been?",0
"Great, amazing, fantastic, guys. Love it, look forward to it. Great to see you thanks so much goodbye forever.",1
We hear you’re talking with the Jiménez transition team?,0
"Oh, no? No? It’s no, so that’s lies from our friend who told us? They’re lying to us?",1
"So, you  talking?",0
"Well obviously Dad is going to sell. We’re looking at fucking logos here, I’ve drafted a resignation statement from Waystar? Yeah?",0
"Scared of needles, not a real junkie.",1
Do you think it’s too small-scale?,0
"No! My only thing with The Hundred is, is it literally too good. Like why hasn’t anyone else done it?",0
"Oooh, we get to run the deck with you? Like we’re at Cyrus Tellis’ business school?",1
"It’s an indispensable, bespoke, information hub.",0
"Every actionable piece of information in the world, on tap, provided in hourly updates across curated verticals in all meaningful areas of: news, finance, sex, food, sports. Inside- inside-inside baseball shit.",0
"It’s clickbait, but for smart people.",0
Shiv?,0
"Yeah? You know what, T, can they give us two?",0
"Tell them they can shove their petrodollars up their human rights record – we need to talk to our sister, okay?",1
You think? What?,0
"Board meeting day after tomorrow? He sells up, but with ATN spun off?",0
Or it’s a brain-fuck? Dad twisting our turnips and playing the fuck trombone?,1
"Hey, Telly?!",0
"Um, one query – Pierce/PGN – what’s the vibezz? Are they in play?",0
Another ten?,0
Oh  not feeling well?,1
"No fine. Tell them I’m – whatever – sudden onset violent diarrhea. I’m sitting on the bathroom floor shooting rusty water through the eye of a needle. Huge apologies. So, you two are thinking we should be buying Pierce? Because that’s obviously what you’re thinking and just to say: it’s quite the fucking pivot.",1
"‘Fuck The Hundred’? Shiv, after Dubai you were high as shit on it. It was basically your idea!",0
"Right, launch a high-visibility execution-dependent disruptor news brand while also performing CPR on the fucking – corpse of a legacy media conglomerate?",0
"Oh yeah, ‘Hey Tellis would you prefer five million in fees from a funding round or thirty-five million from an acquisition?’",1
I thought we were going for The Hundred? Small. New. Fast on our feet?,0
"No! Ken, it’s just fucking – old. You’ve spent the last three months fucking hustling us contributors and backers and—",0
Can we even afford it?,0
But you loved it!,0
"Oh,  her.",1
"Listen, should we just tell her to fuck off? Not go back to the mat with Dad and just – you know, back into that fucking room?",0
Oh for fuck’s sake.,0
And so until now you were just stringing us along?,1
"Alright, Molto Agitato, you wanna fly there? Like Nan Pierce’s little Windsor Dog Show bitch?",1
"Well we’re not getting on a plane without an NDA so we can see everything under that cronky old fucking hood. Look. I’m worried. I am. You wanna fuck Dad. You wanna fuck Tom. I’m the only one who wants to set up a business as a business, that doesn’t wanna fuck anyone.",1
Yeah. I don’t believe you.,0
Please. Guys. Really?,0
"But can’t we do that, but, like, without a banner for Dad?",0
