text,Is_Sarcastic
"You love this don’t you, this is your dream?",
"Sorry, bro.",
A number of reasons.,
I have made a decision to stick with Dad.,
I think everything teaches us that.,
"Hey, Pop.",
Who? The one who matters? Yeah. I’m with her.,
"Nah. No. She was trying to get to Kendall, to push him off course.",
"She was dark cos she was all-in on trying to get to him, trying to talk him round. To like burn the papers. But she couldn’t change his mind. He’s gone bananas …",
Oh yeah. Yeah. She’s solid.,
What for?,
"I just told the truth, right?",
I did not do any positioning! I did the fucking business.,
Hey. El Presidente. How’s your headspace? Are you happy in it?,
"Hey. Dad, how’s your headspace?",
Well that seems like a grown-up solution that keeps everyone happy?,
Now who’s planting a flag?,
"I think it was just one of your mega-turds, Frank. But I guess someone wants to turn that into Silkwood?",
‘We get it’. A bit like those ladies on the cruise ships got it?,
Did you see him tagging their accounts on Twitter? I’m so embarrassed.,
Still works. It does work.,
"Fine fuck you I’ll go out and say I love Dad, sure. Why not? I do. So. Fuck you.",
Uh-huh. Very confident. Massive optimism.,
Tell me precisely every single word they are going to ask.,
Nope. Next question.,
"Mmmmm, no. Not doing that.",
So far these are very bad.,
Are you fucking kidding me?,
"I mean, I got one in the bank. ‘Fly-fishing in Montana’. If you want me to wheel that out?",
Wah-wah. Did they write their questions in crayon?,
Fuck no. This one would make his head explode.,
Can we please find out who asked this one?,
Sure but this is just rude. It’s not really a question. It has a huge agenda. I don’t think people should be thinking things like this who work here.,
Can we get more questions? Like less – questiony? Because these are horrible questions.,
Could we discourage him with a taser shot directly into his peni or scrummage sacking?,
I don’t see him yet? With his stupid walk.,
Trying to kiss or nibble Tom.,
Not staying?,
"Nice. Keep out of the – bloodbath? The fucking, jacuzzi of gore.",
"Uh-huh just been you know, on TV waxing lyrical about me and Dad, out murdering trout and singing sea shanties round the old marshmallow hole.",
"Oh, man. This is … quite a rich brew.",
Urrgghh …,
"It’s, really pretty. It’s kind of—",
It is very very horrible.,
"Mmmmmmm. Ahhhh. Gurrrr. I mean, sure, fuck him. But this is out there forever?",
Did Dad ask for us all to do this?,
"Yeah look, I’m sorry, but I already gave at the office. I’m not signing this.",
Because it makes me feel unwell and I don’t want to. And he taught me how to aim into the toilet.,
Uh-huh then take me to reason court and sue me.,
Yeah but I try to keep it down to like six a day. And I’m not sure this is in my best interests.,
Same. I’m feeling brutally unsucked right now.,
"Me? Just running some numbers with Gerri. On, you know, the fucking— Getting the distribution deals with these fucking— It’s murder.",
Uh-huh. And sorry about the – the letter or whatever. I just—,
No it was just—,
"Well, you know?",
Right. We don’t have to dissect it.,
"Ha, yeah.",
Mmm. Conference call jokes are the best jokes.,
The chiseling little fuck—,
"Wow, thanks for the namecheck, Siobhan.",
"Once again, great joke, Ken.",
"Amazing, Mrs Churchill. Hey, Dad? One thing. Will you stay on?",
"Um, is it just us? Hello? Yeah, I’ve been digging around and I’ve got something, on Ken, good leverage. Shrink his halo into a cock ring. I’m just keen that I do my share, of the fuckery, you know? After the letter and whatnot?",
"Okay, can we strategize? Because I’ve got potential gold and I need your read on how to deploy.",
What I can’t take my shoes off?,
"And I can’t masturbate at a time and place of my choosing? This is a police state you’re building, Gerri.",
"Listen, here’s the thing – I’ve found tattoo-man.",
"Yup. Funny story. Like, fifteen years ago, Kendall’s bachelor party, New Orleans. We did an ironic bar crawl on Bourbon Street and got chatting to a friendly hobo and there was some talk of various disgusting endeavors – ‘would the hobo eat a deep-fried deck shoe?’ – before we finally settled on a rather ‘indecent proposal’, which was to get the homeless man to have Kendall’s name tattooed on his forehead.",
"Yeah, we got Kendall’s initials tattooed on a rando.",
"I know. Horrible right? We a hobo. Shameful. So anyway, I told Sam who told the black-ops team.",
It was surprisingly difficult considering we tattooed a name on him. I mean we basically filed him for later.,
On Kendall? Woke-ahontas? Using a poor’s forehead as a Post-it? ‘Need milk’. ‘Take down Dad’.,
"So. Let’s talk it out over lunch. Tactics, TikToks and dick pics?",
A date? Excuse me. You have a ‘date’—?,
A date at . Fuck off—? With who? Montgomery Clift? The Ghost of Christmas Past?,
"Well, ‘Laurie’. My god. Well he sounds fucking cool. Laurie. You want Laurie to  you, in the parking lot?",
"No I get it. You’re drawing a line? Or what, Laurie might knock my jolly old block off, if he can find his sword stick and fire up his motorized bath chair?",
"Yeah—? Fucking man. This is nuts. Keep a straight face, okay? Is this the dirt from the dirtmen?",
"Oh sure. We should all be upstanding for the guy with my brother’s name tattooed on his head. Mm. Looks like Ken’s stopped eating again? Wonder if he’ll go full anno? Two days – no food. Just sports gloop and apples? Hey. Hey, man.",
How. How you doing? You look good.,
"Right sure. Me too. I’m kidding. But, yeah thanks for being here. Thanks.",
"Right, yeah. Good to catch up. ‘It’s been too long.’ ‘You never call,’ et cetera. Hahaha. Hugo?",
"I’m sorry, and I don’t want to be a dick, but I’m looking, and I’ll just say, you are the guy, right, is it there?",
"I mean that’s a shame, you had something there and it was really working for you. Can I? I mean you can kind of see it? Right?",
"Crazy idea, never happen in a million years – you wouldn’t consider having it – done again, would you? Or a recreation in pen for photos?",
"Right, and without wishing to make this too transactional – how much?? For the photos?",
Oh sure. There must be a number though …,
But maybe they wouldn’t see them if you could afford to send them to a finishing school in Switzerland?,
"I found the guy we tattooed. Justin Albescu. I’m working on photos. I think we got him. I think it really hurts him, Dad.",
Hey. How things looking?,
How was the date? You fuck him or just tug him off between courses?,
"Oh my god you did – you tugged him off under the table, you absolute monster! Tell me, did you wear your work glasses or your whore glasses —?",
Gerri – are you – flirting with me?,
"It was so fucking funny, Gerri. I mean, I wanted to cry and be sick too.",
I’m giving them to Dad. He wants to get them out right away.,
This is a magic bullet. Dad will give me my bedtime bath.,
Ooooh. Gerri – you – care?,
"I hear you tried to kill Dad again, fatty.",
That’s not what we’re hearing. We’re hearing you took an old man out to die in the sun.,
"You tried to assassinate our dad with the sun. Do you have a fetish for killing Dad? Like, ‘just the tip’ but for killing Dad.",
"Well, no he’s out.",
"Frank just got off the phone. Dad’s freakout gave him the shits. Weak leadership, fractured at the top. You let him fucking shrivel, he saw. He has quote, ‘zero faith in the post-Dad leadership’. So go eat a donut, ya jowly fuck. We’re gonna lose the company at the shareholder meet all because you wouldn’t give our dad a timely fucking Evian. Goodnight! Episode Five",
How you feeling?,
"I guess, even on your way to the chair you keep thinking, ‘It won’t happen to little old me.’",
"Okay, here they are! Pump and Dump the corporate clowns.",
Great. ‘Voting’. Let’s throw it open to the fucking retired janitors of Idaho.,
"Those pussies won’t bail once they hear God speak, right?",
"The cavalry has arrived! So, Con, the news is – tomorrow we’re all gonna try to get jobs in the same branch of Target.",
"Okay here he comes! The Big Beast. Ready to kick ass, with his big, ass-kicking shoe.",
They have thoughts? What kind of thoughts?,
Fucking A!,
Does Sandy really have syphilis? What if he’s covered in sores? What if he takes his dick off and waves it around and screams ‘Yahtzee’?,
This is good. More pressure on the Raisin. If he can understand what’s going on.,
"I think Gerri won, Shiv, but nice try.",
"Uh-huh. So, how bad is he? Is it true they’re building him a mechanical dick out of Legos?",
"And, no offense, I have to ask, he is definitely fully aware of everything that is at stake and just he is a full – person – here?",
I mean I’m just going to say it right out since there’s an eighty- five-billion-dollar baby on the table here – Sandy – how do we know he’s not your meat puppet?,
"With all due respect, Ger, get bent.",
What—? No. I don’t know. Why the fuck you asking me?,
Are we good?,
About trying to fuck me over to consolidate your position?,
"Throwing me overboard to drown? You picked your prince, Gerri. Don’t fuck it up now.",
"Hey, hey, hey! Dad, you would have loved it. Sandy had a guy draining his spit so he didn’t choke.",
The PJs? No.,
"Well, duh. Look, no. They’re trying to humiliate him.",
Bullshit. Nah. First they came for the PJs and I said nothing. Then they came for our outsized compensation payments – you know? They’ll back down. They won’t blow it up over this. Dad? What do you say?,
Yes. He’s a fucking – badass. He’s gambling the company cos he’s a fucking baller.,
"Shiv, he said no deal.",
"If we win without a deal, it’s all upside.",
It’s fucking classic Dad.,
He’s trusted his gut before and it’s always worked out.,
He fucking always knows something. He’s six moves ahead.,
Tell her he’d have more time if we weren’t fighting the DOJ.,
"Seriously? Is that—? That’s not bad though, right?",
Should we give him a cranberry juice and ask him again?,
Well we don’t know. What about the phone call he took? The decision might have been a good decision. We don’t know when he went piss-mad?,
Oh do you? The fucking Hercule Poirot of piss here.,
"Yeah, great idea. Dad loves being overruled.",
‘Can he do the speech?’ The piss-mad demented King of England?,
"Fine, have Colin take it out.",
"It’s an imaginary cat, now fuck off.",
Delusional! A delusional man is leaving the room right now!,
But he’ll definitely be okay?,
Let’s take it easy. You wanna give him the fucking Tabasco suppository?,
The main thing is that we look after him.,
Shiv? We’re not going to make the piss-mad bear dance with cattle prods? We need to look after him.,
Well no because Dad said—,
"Go on, go and fuck it up, moron.",
Could we tell him to fuck off. By all accounts he won’t remember by tomorrow?,
Well he can’t talk to Dad. He’s still grieving the invisible cat.,
Gimme.,
He’s a prick with a button. —,
Okay. Well. I’ll relay that. You’re not running again and you hope we’re happy?,
"And I mean this is decided? Because I think, whatever our – our – minor differences we’d urge you, to – to and not to stand aside right now? Uh-huh? But, no I’ll be the messenger boy, happy to be that— I just, I think our position would be – speaking for my father here, you know good friends can be tough in their constructive criticism but, we would say you know and I’ve seen, you’re a really, a significant historical figure with so much more to give, and the whole – family at ATN would rally round— Well, it’s been a privilege to have this opportunity to— Okay then. Well, I hear you. All the best and— Yeah, so, he wanted us to know he’s quitting. He’s got a ‘minor neurological issue’ that the media, starting with us, have blown out of all proportion and he doesn’t want to put his family through blah blah, fuck Dad, fuck me and Ravenhead, fuck ATN and good luck getting the kind of access he’s granted with whoever is the next president. Which, if it’s left up to him, could be a chicken.",
"I mean it’s nice to know we can – like – mold the whole American Republic project and all, but— —",
"I mean, Dad is going to walk out of there at some point …",
We’re good. We’re good. No vote. Hold the voting.,
Stop him. Tase him!,
I’m gonna miss the big boot. At least we could hear him coming.,
Clearly fucking.,
Showing memes to a young menial? Tale as old as time.,
I heard he’s still really into blowjobs. That’s his thing.,
"Think that’s been around for a while, Pop, but yeah, well played, the internet.",
"Oh yeah, we’re all slaves on the Zuck plantation. Picking digital cotton for the likes. I can hit it.",
Boohoo. It’s not our fault the president’s brain couldn’t thunk good no more.,
"Heh. Lil Ms Libtard, how you like spelunking in the elephant’s asshole?",
Wait till the weekend’s over. We’re gonna get our white cis-male stank all over you.,
"Well no, actually, Shiv, the Maniacs are just taking charge.",
"‘The Maniacs’ are actually quite boring, when you look into it.",
Speaking of maniacs.Captain Kook from the SS .,
Yay. The Republic.,
Here? Just a nice political conference of like-minded donors and intellectuals.,
No sure. But really it is.,
"Yeah, sorry about that.",
Dave the steady old plow horse.,
"But at some point you do? I mean eventually you do. Just before you win? MICHELLE-ANNE You don’t want to be the hare, you want to be the tortoise.",
"Hard shell, stubby legs. Exciting.",
"I mean, between us, I think his brain was shot. So it had to come out. You hear some whackadoo stuff.",
"Oh yeah. Apparently heads of state would be coming in to the O and everyone would be like, ‘Has he got the old hot-dog stand open?’ Like check he was zipped up?",
Wanted to use the ding-a-ling like it was a pen. Tried to veto bills with it.,
"Some of it is rumors I’m sure. But yeah we had a duty to report it, even if it hurt our interests overall because we loved the guy.",
It’s like he’s a cartoon bear and there’s always a picnic hamper nearby.,
"Umm, I don’t rightly know?",
Uh-huh. For what? What have I done now?,
"Um, no. Nope? She’s in a relationship with a canoe-shaped gentleman named Rory.",
"Uh-huh? Well, this is— Uh-huh. Well, yeah, this seems to be— Okay well, you know how it is, Glyn. Families! Can you forward this to me?",
"To my mom’s wedding? Yeah I think that’s okay, Glyn. Hey. So, you know about this, you withholding bitch?",
Glyn the Brexit pervert sent this to me. Mom’s getting married. To ‘Peter Munion’.,
"I don’t know. I think I remember, is he one of those guys—? A Sunday-lunch man?",
What the fuck. You call her!,
That’s true actually. Why doesn’t Mom like you? We should call her and find out.,
"Hey, bro. I’m here with Shiv. Just wanted to let you know … New dad just dropped.",
"Mom’s getting remarried, dingus.",
Of course he didn’t know. Ken bores the shit out of Mom.,
"Look, we just wanted to let you know Mom still doesn’t love you, Ken, bye!",
"Oh okay. Hey, it’s the ghost pepper. The spicy new flavor. —",
"Me, I always found it hard to care about politics.",
"I’ve seen your poll numbers. You’re dark-horsin’ it. People buying your whole thing, huh?",
Now we’re talking!,
But with beatings?,
I like this. Just a couple of cool guys having disgusting fun.,
What’s that?,
"Oh, yeah, no. He’s not— That’s not going to happen.",
"Okay, so. Mom says it’s all fine. She is getting remarried, but we’re not to get it out of proportion or cook it up into a whole big thing. It isn’t  but he makes her laugh, he is a little bit awful and vulgar and he wants a huge social wedding to show off in Tuscany and she’s sorry for not telling us but she couldn’t because Rory doesn’t know yet and he might kill himself and he can’t because he’s building her a new chicken coop but he’s got the black dog and it wouldn’t be fair right now. It’s dumb but I guess it kind of makes sense.",
"What? No, Shiv, I am not sad. I don’t give a hoot.",
"No, Shiv, because I’m not eight years old.",
Sick burn.,
You recognize him? The jelly-boned low-T chinless fuck.,
"No. We should stop it, right?",
"Get over it? It just happened. Our mother is getting married to some dickhead crooked-tooth turnip man. What is wrong is how little you care, you frozen bitch.",
"I – I kinda like Mencken but, you know, he’s been shitty, so if it was now I guess, Boyer. But can I note, I do not like Boyer. So. What?",
Oh Mrs Politics? How many big races did you win as a consultant?,
Then do we talk to Mencken and see if we can deal?,
‘Four score years and whatever my sister did bring forth from her bedroom a cup of milky sputum.’,
He’s just shifting the Overton window.,
"Stop Chicken-Littling us, Shiv. It just makes everyone want to take a nap.",
There you go again. So route one.,
You have a trophy husband and several fur coats. You’ll be fine.,
You do? Can I watch you jibe sometime? At some special jibing club?,
"Sure. You get to vote at the election, with the other folks.",
"Easy, Castro.",
"Shiv, can I just say I know we have our differences but you are just  for picking the brown man. Should we send you a particular medal for white women who like brown men?",
"Oooh oooh, I’m the good girl, I pretend to care about people, because no one ever cared about me!",
"Fine fuck you. Yes, I do. Yeah – Mum’s getting remarried.",
"No, Peter, Peter Munion?",
Yeah and she –  would – love it apparently if you came to their Tuscan wedding?,
"Quit butt-huffing Salgado, Shiv. We all agreed to pretend your political career was real, out of pity, but this actually matters.",
"Sure. I dunno. Yeah. I mean ? Crap-pants for president? Um. I guess. Sure. I dunno. They’re all fucking weirdos, I guess, so why not? No offense, Con.",
I mean is this serious? We’re talking about trying to make Connor president. Of the United States of America?,
"Sure. No, fine. Fine. I might call my dentist. He’s a possible?",
If she’s bringing in Soggy Salgado I want to see if we can tame Mencken. Okay?,
Fun shit before. Tripping the light fantastic on the grandpappy’s ballsacks.,
"I mean, sure. Whatever. Hardcore.",
"Nope. No. No dancing here. Not in Pappy’s bathroom. I guess the thing is. I’m just going to say it. Fascists are kind of cool, but not really you know, so is that a thing? A problem.",
Uh-huh? ‘H’? You know there was a very naughty boy called H who—,
You really are a Christian aren’t you?,
And who gets to – to join?,
"And in terms of this here. There’s a thing, right? I mean I get it, you’re 6G, we’re Betamax. But you need us, right? Our news, viewers. The almost-deads. Big slice of pie.",
This is going to be a shit show going into the convention. You need our push.,
Uh-huh?,
Me? I’m creeping on the come-up.,
"I’ve got plans for ATN. Sluice out the oatmeal, add some sriracha. No more ‘Dave Plain-Penis and here’s what the Dow did today’. I want to make it more like … you?",
"My vision? Um … Smash the system. Fresh faces. Poach a couple TikTok psychos. E-girls with guns and Juul pods. Get me some straight-shot blacks and Latinos. Brain science and strength training for the working-class coalition. No more pillows and bedpans, we’re strictly bone broth and dick pills. Deep- state conspiracy hour but with a fucking wink, funny. And it’s all kinda set for the star of the show: President Jeryd Mencken.",
My dad’s a Titan.,
He’s nice.,
"Look, Dad. We came to market to buy you a nice milk cow but we found ourselves a fucking T-Rex. Okay? He’s box office. The guy’s diesel. He’s good on camera. He’s fun. He’ll fight. Viewers will eat from his hand. No downside.",
Oh please.,
"Meh meh. If we don’t come to an accommodation, we get outflanked and we lose the ATN fucking dollar machine when we need cash to fight tech. Look. I guess Shiv wants her way, and I want my way, and Connor wants his way, so it’s even and you have to—",
"Your polling was off again, Shiv. Definitely fucking.",
We’re doing a photo.,
Okay. We got this. Right? This all makes sense? He has some binders on how to make an acquisition of GoJo work.,
"Well, kind of regret staying up all night with my assholes then?!",
"Well. Of course. I mean, I would say we can handle the human stuff without too much issue. That needn’t concern us, it comes naturally, to some of us— which is why I have focussed so much work on the integration benefits, and deal detail.",
Well the big picture is made from small details?,
And you going tonight?,
"I might have to go, just to see how bad it is.",
Fuck you. It’s pure rubbernecking.,
Or she’s about to give birth to Dad’s baby while we chant a Satanic mass?,
It’s fine.,
"Hi. Oh, okay? Champagne?",
"Okay, Boxcar Willie, what the fuck’s going on?",
Laurie?,
Just a number?,
"Amen to that! Top me up, wontcha?",
Uh-huh. Dad’s thinking.,
He knows everything.,
We kind of might need to court them a little though?,
Can we not at least …?,
Unless someone else makes a better offer first?,
We can  talk to him. He’ll be there tonight?,
I’ll reorganize my diary.,
This is even worse-slash-better than I’d imagined. What happened?,
Uh-huh? Horse didn’t want you to fuck it?,
Classic ranch action. Real cowboy.,
Sure. Go. I can do it.,
"Yeah, fuck off, I’m not doing that.",
Busy.,
It’s going great. It’s just when you get to know her she’s actually quite boring.,
"She’s fine, she’s just a bit boring is all. That’s all I’m saying.",
Yes. Loved the intimacy. Love people really getting to know me.,
"So, if we’ve just been born then— Okay? So this is … So I’m inserting myself into my mother’s vagina right now?",
"I’m repeatedly entering my own mother? That is, not right. That’s my mom’s cooch, so you know. And you’re implying it’s massive. I think you should tighten my mom’s vagina.",
Nothing says party like a stack of literature.,
"Ken, pumping out the anti-Dad propaganda.",
Probably standing in a corner monitoring his biometrics on his watch. Maybe let’s just say a quick hello to Ken??,
"Okay. Just to say, I am only here because I’ve heard it’s going to be a five-dimensional catastrophe and I want to see you crash and burn. Also, I’ve just farted. So yeah – happy birthday.",
"My god, it’s like you  old. It’s like hugging a leather satchel filled with human remains.",
"Cough syrup and space dust, shoved down the gullet on a bed of spoon.",
"Uh-huh. And tell me, did you get Mom’s permission, for the use of her—?",
Call me old fashioned – I just feel like you should ask before you construct a giant replica of someone’s vagina?,
Your dad.,
Any real friends?,
From Dad.,
"Um, I think it’s all your milk teeth and an iTunes gift card. No, I’m kidding. It’s nice. It’s a nice thing. We hope you’ll like it.",
"Well, everyone in this room is now thinking about me jacking off. So who’s the real winner?",
One percent? Congratulations.,
"Well, okay. Let’s go!",
Shiv? Please.,
"Sure, but maybe leave the talking to me?",
That’s funny because lately everything I touch turns to gold and everything you touch withers and dies.,
Okay? A forty-year-old man rebuilding his childhood treehouse should instantly go on the sex offender registry.,
Um? The ranch? Montana? Is it?,
"Sure, man, I’m a walking rainbow band.",
"Yeah hey, Ken. May we please step inside your mental disorder?",
Yeah we’re here to do body shots off McCartney. Can we come on in?,
Why?,
"‘Colossal dick-cheese’? All lowercase? C’mon, fatty. Heave-ho.",
"Ken, don’t be a fucking moron.",
You’re actually not going to let us in?,
"Okay, so what? We just wanna talk to him. What’s the difference?",
LET US THE FUCK IN.,
Who’s that?,
Unbelievable. I genuinely hope his kidneys fail.,
"What? That’s nothing. Just a little move, to ease him out of the holding company.",
"Well, he can only sell to family, right, and yeah I think Dad put me on there. It’s housekeeping.",
"It’s a name on a piece of paper, Shiv.",
"I can’t even do anything with it, it’s musical chairs.",
Dad and I handled it. You wanna figure out the financing? —,
Okay. Clown time’s over. Let me in.,
He was . I’m his fucking brother. Google it. Do you know what I could do to you?,
"Hey there you are! Hiding away like a human VPN! How’s it going, dude?",
Oh. I hear you. ‘Life’. Exhausting.,
I hear you. Love pussy. You see my mom’s? —,
"Pussy. Huh. Yeah. So, look, my old man, he got grumpy this morning, but you weren’t trying to humiliate him, were you? I mean everyone says, everyone, last big legacy-content library – last fucking super-app streaming platform. We fit right?",
Hit me.,
When will he ?,
"Um, well? I couldn’t rightly say!",
"Hehehe. Yeah I mean we’re laughing but he is my dad, so that’s – pretty— You know, ‘Go easy there chief!’",
"No, I can understand that.",
"Sure. Well, look, we’re all obviously— hugely looking forward to my father dying. But there’s another shape to this.",
"Good, yeah. How about you never have to talk to him. You can work out of Austin, London, Berlin, Geneva. Totally separate corporate identity. StarGo we burn obviously.",
