text,Is_Sarcastic
"Uh-huh, well it took long enough. What is it, a fucking goose with a saddle?",1
"What the— Sorry, is this me?",0
Well it’s weird. Where did they get the photo?,0
"Yeah well it makes me want to join ISIS, okay? Stop it. Jess?",1
You gonna?,0
"Well hello, Kerry. And how are you doing?",1
Yeah we’re – in transit and—,0
"Um, that was my sister saying that I’d hear you better if you took Dad’s cock out of your mouth?",1
Would we consider at least a call?,0
Did Dad ask?,0
"Look if he was to call, we could see.",0
"Oh we actually know him quite well, Kerry. I mean we’ve never licked his big omelette nipples but—",1
"I am going to need to hear that voice I’m afraid, Kerry? —",1
"How’s your vineyard, Shiv?",0
"Uh-huh. Brave. Fighting through all the chiffon, eating all that chicken breast. Fucking Che Guevara.",1
"Oh, we get to talk to an old lady about newspapers now? Amazing! Thank you  much.",1
We’re fine. It’s a complicated private situation.,1
"Okay, well, lovely trip, great to see you guys!",1
"Don’t worry, she doesn’t care, she isn’t really a human being.",0
"Sure, confusing. What comes after nine? There must be some planet brain out there who can figure it out. Whither Hawking?",1
Oh she appreciates?,1
"You fucking jerking off to your yacht catalogue there, T?",1
"He’s going to bill us two hundred mil for that strategy advice. Thanks, T.",1
Fucking Tom’s on this for Dad?,0
"Go first, Tommy. Build the trust, bro.",0
"So we think Dad’s around eight-five, nine, so we’re nine-five to top them out? But ten to show we’re really serious? So, the half-bil extra is just – that’s just an extra half-bil?",0
That’s a pretty penny for a conversation-ender? Can’t we just fart?,1
"Oh it rounds it out, it does that, it makes it  divisible. You do know what half a billion dollars is? Five hundred million dollars?",1
"A million is a thousand thousands. You do know that. So this is five hundred times one thousand, thousand dollars of actual money you could spend on fucking – snowmobiles and sushi.",1
Sure but is it worth it?,0
"Man, I wish I went to Harvard Business School like you, T. Did they crochet that onto your ballsack?",1
many olds. They’re running a silver mine over there. Where are the hotties?,0
Bloodlust! God our PGN will crush this peanut brittle.,0
"Creative retreat, Telly. Blue-sky. No bad ideas, except yours.",1
Sorry – I just can’t seem to tear my eyes away from the bald man talking about NATO.,1
You would not watch that.,0
"Or? Shove all your farm report, melatonin news-hour info dumps into daytime and primetime, we go full  — this is the world, feast your peepers on its horrible delights!",0
"Dad occasionally had some success running a news network, Siobhan?",1
Yeah. An environmental show but not all doom and gloom?,0
Not all of it? Sharks?,0
All good?,0
"Dad would shit. There’s fruit on the table I don’t know, and I know my fucking fruit.",0
Man. Dad was a god. Tomorrow he’s selling the empire to a 4chan Swede and dishing out jobs for BJs.,0
That voice! Vocal-fry Goebbels. What the fuck is that?,0
Hugo – no question. Absolutely.,0
Excuse me?,0
We’re good. We’ll just jump in and figure it out—,0
"We have to be somewhere and if we don’t take that chopper— I will set aside several hundred thousand dollars, and I will dedicate it to destroying your life.",0
Oh you can’t speak to that?,1
What’s it doing?,0
It’s fucking nuts. We’re going to be late. Connor’s gonna shit. It’ll be guilt trip to the moon. Do we call. Maybe this is a mistake?,0
"Oh great, what? Getting stuck in traffic with all the fucking, traffic fucks.",1
"Uh-huh. Hey, Buddha, nice Versaces.",1
Sandy? The brain in a jar with a dildo attached?,1
"Tonight? Nah. It’s the board again. Right? Stewy’s been saying Sandy thinks there’s more juice in the Swede, are they flying that again?",0
"Well they can’t— We’ll be at the rehearsal dinner. So, no, right? I don’t want it to get all hokey.",0
"Late for Connor’s rehearsal? Even later. Nah, I think it’s just fuckery.",0
"Oh come on. It’s done. Dad’s lots of things, but no one ever accused him of being soft on a deal. It’s fuckery.",0
"I mean I love the idea of not going. But I think we have to drink at least a couple of Martini Passive-Agressos to make up, no?",1
Hey? What the fuck?,0
"Well more than— What is this, an ambush?",1
I don’t think so. Okay – see you!,1
"Look, I think our position might be that we’re done cornholing our dad.",1
Yeah sorry. Willa? You okay?,1
Is it over?,0
"The bride is normally, I guess, is generally considered one of the first team at the old wedding?",1
"Um, no. I guess?",0
Um. I don’t know?,0
"Oh, man.",0
I think it seems like we should?,0
That bullshit?,0
"You okay, man?",0
We saw Willa?,0
"Nah, come on, Con, you’re good. Throw her another ten K? Snowmobile and some teeth-whitening vouchers? I’m kidding.",1
"Shiv, he looks pretty rough?",0
"Sandi’s a greedy little bitch, she’s got her hand up the ass of the carcass of her dad, Stewy’s come along for the ride. It’s a packet of horseshit.",1
Would it be possible to do anything other than that in the entire universe also including mainlining ratshit?,1
I mean we can do one drink though? Yeah? Little bachelor party?,0
Do you think they know the recipe for a vodka tonic?,1
"Hey, Con? You with us?",0
Sure. On another guy’s dick. Sorry. Too soon.,0
We’re eating. Right here in Billy Ray Cyrus’s Kentucky Fried Shit Shack?,0
And what was that?,0
Oh fuck. What now?,0
Oooh ‘wings’. I wonder from which particular creature they snipped these ‘wings’? You think a mammal?,1
Oh my god yes. It’s quite the compendium of delights! I think I’ll be ordering off-chef.,1
"We’ll get back to you, we’re gonna order off-restaurant.",0
Why don’t we fold Con in?,0
"But he has a share. If the deal collapses, he’ll lose his payout?",0
Shiv wants to get us mixed up in some drug deal to screw the vote tomorrow.,0
Oh what the fuck now?,0
Really?,0
Exactly. Maybe .,0
I don’t know. Ask him.,0
I dunno. Sure. It’s just a check-in.,0
No. Look – I guess he’s got voting fears. He’s got the vibrations.,0
"My phone? No! Look, I said one happy birthday, I said sorry we missed it. This is – now an unprovoked check-in.",0
Drama queen.,0
"So, never? Fuck you, looky-lookies.",0
Show us your phone. World’s biggest WhatsApp group for sharing shots of your snatch. Fuck you. No.,0
Are you fucking serious? Oh my god you’re serious. My god.,0
"Fine, fucking bullshit. It’s mostly dick pics I sent him anyway. He kind of got a taste for them.",0
Why? What did I say?,0
"He’s our dad, what do you want me to say, ‘Happy birthday hope you fall down the stairs, shithead’?",0
Fuck you ‘betrayal’. ‘Happy birthday take care’?,0
"Fucking family guilt trip, European vacation.",0
"I’m sure there’s maybe one more horrible motherfucker lawyer left in the United States, if you really look? But I’m sorry.",0
"But we want to do Pierce, we wanna get out?",0
But Matsson won’t go up in price. I know. I spoke to him earlier.,0
"Yeah, he’s secretive. But we’re tight.",0
"Look, he thinks I’m fucking cool and he tells me everything. And he told me, this is his ceiling.",0
Seriously. I think he might walk.,0
He sounded like he meant it.,0
"I don’t give a shit about conflict, I’m in constant fucking conflict.",0
If anyone’s got Dad feelings it’s you. Poking Satan with a – fork. I’m fucking genuine about us three.,0
"Fine. Fine. Just spare me the fucking talking to, okay? Stop fucking ganging up on me like you’re Lennon and McCartney and I’m George. I’m John. You’re Ringo. You’re Yoko. And he’s the drummer from Wings.",0
It’s just a move?,0
"Then I guess, so long as it’s a play I’m in.",0
I would imagine that’s a yes. Longest night of my life.,1
"I would agree. Don’t listen to Shiv, Con. Do not let Willa go.",1
What do we do? Should we leave? Will he come in? He won’t come in?,0
"This is some Guantanamo-level shit. What is this? Con. I think I want ‘Desperado’? Please? Okay, I don’t know why he’s calling me?",0
I’m not! Hey! You could’ve just let it ring out?,0
I don’t think he’d come?,0
‘My Dad’s a Media Mogul and a Terrible Scary Bastard’. It’s an album track.,1
Says the woman who’s been making him jizz into a cup so she can create a monstrous Frankenbaby.,0
"He’s not going to come, right?",0
Too late to jump out a window? Hari-karaoke?,1
"Yeah, this is family fuck-fuck.",0
It’s maybe more complicated than that.,1
Oh? You’re not gonna be on TV?,0
"What are you apologizing for, Dad?",1
"Are we actually doing this, Dad? Cos. I think. You know. Seriously what fucked all this was … when … with Mom and Italy and …",0
"Well, no. Everyone hit me. I’m annoying.",1
What kind of—? One of the bad ones?,0
"What is this, Dad?",0
So you actually don’t have cancer?,1
I feel like I might be getting cancer now?,1
Nuts. We should check that out though.,1
"Yeah, uh-huh. Cool.",0
"Hey, Dad. And looky looky here. Twin Cities Tessie. Thought I smelled dairy. So yeah, just felt that got weird and there was a lot going on.",0
"Oh yeah? I mean, it’s the wedding. Con’s wedding? But – feels, yeah, let’s see—",0
What about Tommy Two-Tits?,0
Uh. Sure. I didn’t come to – to you know—,0
Maybe I should go?,0
Nah. No.,0
Uh-huh.,0
You really want me? At ATN?,0
"Well, it sounds good. Can I think about it? But it does.",0
Oh? Okay. Um. Yeah. Yeah. Yeah? Um—,0
Just only thing is. Con’s wedding?,0
Are you gonna make it at all?,0
"It’s his wedding day, Dad. I don’t want him to shit his bag. You know?",0
"Right. But also, I guess. The sort of shift in things with— I haven’t actually told Ken and Shiv yet, that I might not be following through on our plans and—",0
Uh-huh. I will. Maybe not today.,0
Right.,0
"Yeah. No, sure.",0
Uh-huh?,0
Oh yeah?,0
"Oh right. Right. Okay. Well, let’s discuss?",0
Me?,0
Dad?,0
Well. Sure. Yeah. Okay. Yeah?,0
Yes I am. Why?,0
"I’m fine, Shiv. Let’s just enjoy the freak show.",0
"No. Jesus Christ, Tom. I just spoke to him. She’s not here yet.",0
Yes I am going to do it.,0
"I’ll let you know, okay? Back off, inflatable dicky-dick?",0
"Hey, Ger. How you doing? You look – well.",0
"And nothing. You look, healthy.",1
I was being nice. Can a guy not be nice anymore? Happy whatever. Happy Whoremas.,0
What what?,0
What? I’ll stare right in your stupid face if that’s what you so desperately desire.,1
"Nothing. You just make me go weird, as you know and fully intend. Look, let’s talk. Later. In thirty. Once we set sail?",0
"I just need to talk with you and we should do it later. It’ll be better, because— No doubt you can tell from looking at me, it’s not great. But my dad said it, so— It’s a message, really.",0
"Look, it’s not official, and, it’s a heads-up from me, but yeah, they’re gonna stuff your mouth with gold, and it’s all good and maybe we can talk him down but yeah as an early warning and I didn’t intend to get into this – but yeah.",0
He’s unhappy about how long it took you to settle with the DOJ.,0
And the number – the fine. Too big.,0
I guess you’ve lost his confidence.,0
"No, don’t be so stupid and reductive.",0
"Oh fuck off, Gerri, don’t moan. You’re not a moaner.",0
"No. I don’t know. Gerri, don’t be weird. This will all be totally fine. It’s nothing, so shut up. I’m doing you a courtesy by letting you know. You can go legal but we’ll stuff your mouth with so much fucking gold and that’s just how it’s going to go. You wrote the playbook, Gerri.",0
"I am, on a ‘human level’, obviously sad so— I am sorry. And off the record, Ger. I do perhaps owe you the opportunity to throw your shit at the wall?",0
"Dad. Can you call me back? That was— It was horrible. With Gerri. So. I’m just— I dunno if— Don’t listen to this if you don’t want to but I’m, I’m not totally okay with … Are you being kinda shitty with me? Cos your son’s getting married and you can’t just – fucking keep expecting me to bend over for you being cunty. I’m just asking. Yeah so that’s the question. Are you a cunt? Give me a buzz!",0
— the funny farm—,0
"And um, Willa – I’m looking forward to saying ‘hi’ to everyone, and mixing it up and whatnot. But is there also an area that is – if we don’t wanna get Roy-ed by the Big Gulps?",0
Thank you. I mean I wanna meet everyone and get into it all about their jobs and children and everything but – you know?,1
Me? No idea. I don’t know.,0
"Don’t talk to him, he’s a filthy pornographer.",0
She’s a good person. She’s like a decent human being.,1
"Hello, fucky sucky brigade, how can I help you?",0
What?,0
"Dad’s sick. How sick? What is it? Hello? Tom, what’s happening, what’s going on?",0
Oh fuck.,0
"And the – the – machine, the— You have a—",0
"Who is that, what is that?",0
Why does Frank think that?,0
"What the fuck do you mean, Tom? —",0
Well should they be?,0
"Are you serious, Frank, fuck me.",1
Can you even breathe without – heart— Can you?,0
We’ll get Shiv.,0
"Can he hear, is he okay? Is he okay?",0
"Hey, Dad. Um. I hope you’re okay. You’re okay. You’ll be okay, alright? You’re a monster. You’re a, you’re a fucking Trojan. You’re going to win this okay? I – I don’t know. You’re good. You’re a good dad. You’re a good dad. You did a good job. I don’t know what the fuck I’m doing. I can’t do this.",0
I don’t fucking know.,0
It’s okay. You’re a good guy. You’re a good guy. They think he’s gone now.,0
They think Dad died.,0
I’m sorry.,0
"He’s been putting us by Dad’s ear, to speak.",0
I don’t know.,0
"Go private. Just speak. It’s weird, but speak. You never know?",0
What’s happening? What precisely is happening now?,0
"Okay, so they’re still doing the chest compressions?",0
Yeah well do— Who is their medical people. Who the fuck are these people? Who are they? Tom?,0
"Okay. And they’re what, in contact? Direct, another line?",0
"But that doesn’t mean he’s dead? Medically, right.",0
"Do those fucking clowns know what they’re doing though, Tom? Are they hurting him?",0
When are you gonna land? Are you turned around? Are you coming back?,0
What did Frank say?,0
"Tom’s open but there’s nothing to say. They’re, doing – they’re still doing it.",0
Tom said like forty minutes.,0
Right.,0
He got short of breath?,0
"There was like no time, Shiv.",0
What was he— [doing?] Was he  his phone. Do we know if he checked his messages? Is anything happening?,0
Oh Jesus.,0
I don’t know. I don’t know if I said – good things?,0
Yeah I don’t know what I said? What did I say?,0
Uh-huh. Did I say I loved him?,0
"This is so fucking— Tom, can you put the phone back with him maybe? Or I don’t know. I don’t— Shall we just leave it open here?",0
Oh fuck. We should tell Con. We should get Connor?,0
"Can you, Ken? I don’t think I can. I could, but— [I’d be really grateful.]",0
I mean do we definitely tell him?,0
"Sure. I mean, just to be nice, would it be, better to, like there’s nothing he can ?",0
"Too weird, too weird. No, go.",0
"Hey, Con. I’m sorry.",0
There. People. People came. I couldn’t speak to—,0
"I said, ‘Hello fucky sucky brigade,’ and he was in the bathroom.",0
"Yeah, I don’t know, he was in trouble and—",0
"We don’t, I mean we don’t actually know, like we don’t  he’s gone.",0
"I think we just need to get him back, we need to get him back and find out, like what is going on, it may be, fucking, those goons, it may be, you know. We don’t actually know anything really. Fucking Tom.",0
We need to get some proper doctors in there.,0
Yeah well we don’t know that – so?,0
"I’m not saying anything, all I am saying is we don’t actually know.",0
Oh what I’m fucking ?,0
Yeah we don’t know shit. They’re still working on him.,0
Anything could be happening. Could be a fucking hoax. It could. What if it’s a drill? What if it’s all a big test? Ah?,0
It just does not feel very likely to me that he is dead?,0
I don’t know if they should though?,0
Should they cover him actually in case— [he needs to breathe or something?],0
I think we’re going.,0
"Hey, guys. You’re on speakerphone.",0
Oh it’s a ?,1
I’m welling up.,1
"He might not be dead. I mean he might be but all the information we have is from some fucking – corporate bozos and some airplane sluts. They probably tried to resuscitate him by blowing up his dick. No doctor has actually seen him. I know what is likely but I am actually not being crazy. Mad shit happens. It’s fucking five, three percent possible. That is all I am saying so don’t look at me like I’m five fucking years old.",0
"Oh, pretty significant. For him, we’re talking top ten right?",1
I think we should get him down.,0
Hugo. Easy. She’s doing her best.,0
"No, it’s okay, it’s sensible. I know you’re glad he’s dead and you want to grab the crown.",1
"I did say I loved him, didn’t I? Did I?",0
"I feel like I didn’t. I spoke to him twice, right, once, then you went to get Shiv? What was it like when he told you, Shiv?",0
We don’t have to. We don’t have to do anything. Our dad died.,0
"Oh, man. How?",0
Right.,0
Um. Yeah. Same. Can’t think.,0
Yeah.,0
Yeah?,0
"I just don’t know if I can, literally, do anything, or talk to anyone.",0
We don’t want to just let Karolina handle?,0
"Uh-huh. Well, I mean, I would, I don’t want anything happening we don’t, like approve. So. Yeah. Yeah?",0
"Oh, man, I didn’t really want to do anything.",0
Hey.,0
"Yeah. Um, I need the room.",0
I’m pretty sad.,0
"Yeah. I mean I’m actually – right now. I’m totally numb. But yeah, theoretically, you would say, I’m – yeah, sad.",0
"Yeah. And – I don’t know, what happens – about earlier. I actually called him back and I called him – a— I said he was a cunt or something.",0
So. That’s nice to know. It was like a joke I guess. But. What a fucking mess. —,0
"Good. No still excited. Very excited. Full steam ahead. I think. More to follow, Lukas, more to follow. Yeah. I’ll pass that on to, to him. It is serious. It’s serious, but hoping for the best. Hoping for the best. We’ll let you know. Thanks, Lukas. Urgh. Didn’t feel great. But I guess. We can explain.",0
"Well, just sort of – steady as she goes.",0
"Well, we’re already full steam ahead so – full steam ahead is steady as she goes? What? I didn’t even want to fucking call.",0
"That’s just – a continuation. He just died, Ken. Man. It wasn’t a move.",0
Are we gonna be okay?,0
"Yeah, you’re not gonna be okay. You’re fucked. You are completely fucked.",0
There’s Dad. You see him? We gonna go look?,0
I don’t know. Should we?,0
"I dunno. I think, I think I’m going to see him? Yeah. You coming?",0
"Hey, man.",0
Marcia? The belle of the ball.,0
In Marcia’s trunk. Inside an anaconda. Inside a sarcophagus.,1
"I can do a phone-sex bit if you want. I thought you might not be in the mood? Yeah, I’m actually fine. I mean I’m sure it’ll crush me eventually. Freight train coming – but today – I’m okay.",0
"I wonder if I thought about it so much, one way and another, maybe I’ve, I don’t know – pre-grieved?",0
"I know he’s – gone, I do know that. But I’ve maybe sad-hacked it, thought it out?",0
"I guess I’ve been paying into a grief bank for years, so, I’m sad – but I’m fine.",0
Right.,0
He was gonna fire half that room. Do people know that? Should we get that out?,0
"We’re not playing Chutes and Ladders, Greg. Our dad just died.",0
"You need to find a new mommy, we’re not your mommy. Um. Matsson. Do I?",0
"Hey? Oskar? Um. Roman Roy, Lukas called but I was just rounding up my chimpanzee friends because they wanted to say hi too. Is he there?",1
Oh right? Can you get him?,0
Thank you. Yes. Yes.,1
"Okay. Okay, man. Great. Okay, well. Jesus fucking Christ.",1
Only really if he saw a hobo on fire.,1
"To be honest, from where I’m sitting, it’s you guys who look naive. I’ve been worrying this was going to happen for ages. How are you?",0
You’re going to destroy this.,1
The reviews are in.,0
Bit racist.,1
Never paid a penny in US tax.,1
Now that’s unfair. I think ‘well connected’ is generally accepted to be a euphemism for pedophile? And no one ever suggested —?,1
Oh shit! It’s ! Who’s got to marry who? Is Connor the child of an oak tree?,1
Uh-huh. From when?,0
Yeah. Yeah.,0
He’s torn it to tiny shreds but if you put it together again it reads ‘Kendall’? Kidding. I’m kidding. Let me see?,0
"Ken, sure, man, I get it, but, it’s old. You tried to send him to jail like twelve times since then?",0
"So, what else does it say?",0
He has a shit-ton of investment impressionism. He’s got three Gauguin’s no one’s ever seen for tax reasons.,0
He probably wrote it to remember your name.,1
"He wanted to see less of you. That’s probably, like fifty-fifty, ‘ Greg or kill Greg’?",0
Hm. Hm. Yeah. And it is interim.,0
What you thinking? Regulatory issues? If the deal wobbled or —? What?,0
Colin does jeans?,0
What happens to Colin now? Does he go do security for Hooters?,0
"Hey Marcia, who ordered the beefcake?",0
"Right, not like all his  from – his men’s group and choir. His pals from the corner bar.",1
"Shiv, we’ve got all sorts of ghouls here. C’mon.",0
The guy might be president this time next week?,0
"Oh I think I have a counter-veto, cos, weirdly, my dad just died too?",1
"Oh what Dad’s gone, let’s get Big Bird on ATN doing round table? Do we wanna make the one thing we’re left with worse?",1
We can’t— You can’t do the Emancipation Proclamation in a day.,0
"It’s the circus. ‘If there is no God, why do walnuts look like tiny brains?’ That was a segment.",0
Who the fuck made him king of the day?,0
"Dad? Um, if you like Benny Hill and Sinatra is that an anarcho- capitalist?",1
Worst play on Broadway. Two stars. Check your brain at the door.,0
"And so, why is he doing that with his face can I ask?",1
Frozen into a – smile?,1
Uh-huh. Sure. I think he just winked at me. Can we put a drape over him? He looks like he might start dancing. I guess they were close. Dad and him?,1
"Sure. But I guess, who do we prefer, one of us or one of them?",0
"Hey, you okay.",0
I’m sorry. Do I have your private number? Will you send it.,0
Uh-huh. Sure.,1
"I can get it, it’s okay. It’s okay.",0
"‘Take her out the back, Billy.’ Always good to hear.",1
Seems a little tough?,0
Is she carrying Dad’s luggage? I don’t think so. Nah.,0
Hey.,0
I work with his barber. You?,1
Exactly. Grab a corn dog and enjoy the ride!,1
"Oh, Tommy Wamby. Tightrope Tommy. Riding his fucking subtle-cycle across Niagara Falls?",0
"Okay? Jesus Christ, does she know she can go back?",0
Shall we all move in. Like the Banana Bunch?,1
You know Peter Munion was flying to Spain and tried to fly right here. He wanted to be with us ‘at this difficult time’.,0
"Can I get you anything else, Mrs Ferreyra?",0
They wanted us to ‘shore up the midfield’ and Dad was reluctant to spend.,0
"Dude, don’t ask me. Not only did I not know Hibs were Catholic, I didn’t really know I was.‡",0
I guess I do too.,0
"Nah, I’m done with helping old ladies across the road. I just wonder about – about – about – about—",0
You know everyone remembers you trying to send him to prison?,0
"COO is on the draft plan, right? I’m a COO. I know Matsson. I was very close with Dad. We had a number of communications you were aware of and some, that honestly, now isn’t the time, but you weren’t. And yeah, I just think. We were close and— Honestly, Ken, it just, it feels better. It doesn’t feel good to us – right, Shiv, right now for it to be just you. So. Them’s my words. I don’t know, this whole thing is a big deal but I’m done fucking, twisting and turning, I’m just gonna say it.",0
Yeah?,0
Three is a bit wacky? Two is fucking. Three is a weird cuddle puddle and no one gets laid.,0
"You’re inside everything. Look. I’m not fucking anyone, this is just to sell and— Yesterday was real, it was real, we’re connected. I feel good on this. I feel really good.",0
Everything.,0
Yesterday.,0
Hey.,0
Cool. Dry opener.,0
Ha. Well. Yeah. Good. I guess that’s ‘under discussion’. Come on in.,0
You didn’t say that?,0
Well you keep working that routine.,1
Oh thanks.,1
Oh hell yeah. Yeah.,0
Let us talk to some folks.,0
This is a good group.,0
"If you’re uncomfortable you can leave, Frank. It’s a lovely gang of pals having a chat.",0
Like forty-eight hours ago?,0
Our dad was tough.,0
"I think we all know he had soured on you, Gerri?",0
We’re obviously the people to take over from Dad because we were closest to him.,0
Yeah right.,0
We know the board is very excited about the deal and so are we. It’s a good deal.,1
Yeah. Thanks. Great day. Great week.,1
God. Did you know he did Sudokus?,0
Oh Jesus Christ.,0
It’s Operation ‘Shit on Dad’.,0
Are people gonna buy that Dad was a puppet?,0
"Whoa! Yeah. I do have certain feelings of queasiness, about, I guess – shitting on our dad while he’s still up at Frank Campbell’s?",0
"Thanks, Hugo. Karolina. But never bring us this disgusting shit ever again thank you?",0
Thank you. More to follow!,0
